{
  "contract_id": "play_entity_position_sync_clientbound_framed_dispatch_contract",
  "case_id": "play_entity_position_sync_clientbound_framed_dispatch",
  "scope": "codec",
  "official_functions": [
    {
      "path": "_analysis/minecraft-26.1.2/client.jar",
      "function_or_member": "ClientboundEntityPositionSyncPacket(int, PositionMoveRotation, boolean)",
      "role": "Construct the official Play clientbound entity_position_sync packet fixture"
    },
    {
      "path": "_analysis/minecraft-26.1.2/client.jar",
      "function_or_member": "ClientboundEntityPositionSyncPacket.STREAM_CODEC, PositionMoveRotation.STREAM_CODEC, Vec3.STREAM_CODEC, ByteBufCodecs.VAR_INT, ByteBufCodecs.BOOL",
      "role": "Write, decode, and observe the official entity_position_sync body"
    },
    {
      "path": "_analysis/minecraft-26.1.2/client.jar",
      "function_or_member": "GameProtocols.CLIENTBOUND_TEMPLATE.details().listPackets(...)",
      "role": "Name the packet id assigned in Play clientbound state"
    },
    {
      "path": "_analysis/minecraft-26.1.2/client.jar",
      "function_or_member": "GameProtocols.CLIENTBOUND_TEMPLATE.bind(RegistryFriendlyByteBuf.decorator(RegistryAccess.EMPTY)).codec().encode/decode(ClientboundEntityPositionSyncPacket)",
      "role": "Write and dispatch-decode the full official Play clientbound entity_position_sync frame"
    }
  ],
  "invariants": [
    "The official Play clientbound table assigns entity_position_sync to packet id 0x23.",
    "The official Play clientbound protocol codec dispatches the entity_position_sync id to ClientboundEntityPositionSyncPacket.",
    "The official entity_position_sync body is entity id VarInt, PositionMoveRotation, and onGround boolean.",
    "The fixture uses primitive constructor values, so it does not require initialized Entity, Level, registry contents, or game state.",
    "The framed bytes, packet table id, body bytes, decoded packet class, decoded fields, Play clientbound packet table, and remaining decode byte counts are generated by the official jar-backed answer artifact.",
    "This contract does not prove initialized Entity/Level behavior, entity existence, spawn readiness, render readiness, or client-load completion."
  ],
  "answer_path": "oracle/answers/775/play_entity_position_sync_clientbound_framed_dispatch.answer.jsonl",
  "rust_test_target": "oracle/rust-tests/tests/oracle_contracts.rs",
  "test_topology_note": "rust_test_target names the current case adapter only; the manifest owns the runnable test topology.",
  "stop_boundary": "Do not use this framed dispatch/decode contract to infer initialized Entity/Level behavior, entity existence, spawn readiness, render readiness, or client-load completion."
}
