{
  "contract_id": "play_set_chunk_cache_radius_clientbound_framed_dispatch_contract",
  "case_id": "play_set_chunk_cache_radius_clientbound_framed_dispatch",
  "scope": "codec",
  "official_functions": [
    {
      "path": "_analysis/minecraft-26.1.2/client.jar",
      "function_or_member": "ClientboundSetChunkCacheRadiusPacket(int)",
      "role": "Construct the official Play clientbound set_chunk_cache_radius fixture"
    },
    {
      "path": "_analysis/minecraft-26.1.2/client.jar",
      "function_or_member": "ClientboundSetChunkCacheRadiusPacket.STREAM_CODEC, FriendlyByteBuf.readVarInt/writeVarInt",
      "role": "Write, decode, and observe the official radius body"
    },
    {
      "path": "_analysis/minecraft-26.1.2/client.jar",
      "function_or_member": "GameProtocols.CLIENTBOUND_TEMPLATE.details().listPackets(...)",
      "role": "Name the packet id assigned in Play clientbound state"
    }
  ],
  "invariants": [
    "The official Play clientbound table assigns set_chunk_cache_radius to packet id 0x5f.",
    "The official Play clientbound protocol codec dispatches the set_chunk_cache_radius id to ClientboundSetChunkCacheRadiusPacket.",
    "The official set_chunk_cache_radius body is one VarInt radius.",
    "The fixture uses a primitive radius only and does not require initialized chunk, Level, or render state.",
    "The framed bytes, packet table id, body bytes, decoded packet class, decoded radius, Play clientbound packet table, and remaining decode byte counts are generated by the official jar-backed answer artifact.",
    "This contract does not prove chunk loading, world hydration, render readiness, or client-load completion."
  ],
  "answer_path": "oracle/answers/775/play_set_chunk_cache_radius_clientbound_framed_dispatch.answer.jsonl",
  "rust_test_target": "oracle/rust-tests/tests/oracle_contracts.rs",
  "test_topology_note": "rust_test_target names the current case adapter only; the manifest owns the runnable test topology.",
  "stop_boundary": "Do not use this framed dispatch/decode contract to infer chunk loading, world hydration, render readiness, or client-load completion."
}
