{
  "contract_id": "play_keep_alive_clientbound_framed_dispatch_contract",
  "case_id": "play_keep_alive_clientbound_framed_dispatch",
  "scope": "codec",
  "official_functions": [
    {
      "path": "_analysis/minecraft-26.1.2/client.jar",
      "function_or_member": "ClientboundKeepAlivePacket(long)",
      "role": "Construct the official Play clientbound keep_alive packet fixture"
    },
    {
      "path": "_analysis/minecraft-26.1.2/client.jar",
      "function_or_member": "ClientboundKeepAlivePacket.STREAM_CODEC, FriendlyByteBuf.readLong/writeLong",
      "role": "Write, decode, and observe the official keep_alive body"
    },
    {
      "path": "_analysis/minecraft-26.1.2/client.jar",
      "function_or_member": "GameProtocols.CLIENTBOUND_TEMPLATE.details().listPackets(...)",
      "role": "Name the packet id assigned in Play clientbound state"
    },
    {
      "path": "_analysis/minecraft-26.1.2/client.jar",
      "function_or_member": "GameProtocols.CLIENTBOUND_TEMPLATE.bind(RegistryFriendlyByteBuf.decorator(RegistryAccess.EMPTY)).codec().encode/decode(ClientboundKeepAlivePacket)",
      "role": "Write and dispatch-decode the full official Play clientbound keep_alive frame"
    }
  ],
  "invariants": [
    "The official Play clientbound table assigns keep_alive to packet id 0x2c.",
    "The official Play clientbound protocol codec dispatches the keep_alive id to ClientboundKeepAlivePacket.",
    "The official keep_alive body is one big-endian long id.",
    "The fixture uses a primitive constructor value, so it does not require initialized client/server state.",
    "The framed bytes, packet table id, body bytes, decoded packet class, decoded fields, Play clientbound packet table, and remaining decode byte counts are generated by the official jar-backed answer artifact.",
    "This contract does not prove runtime keep-alive response behavior, Play entry, render readiness, or client-load completion."
  ],
  "answer_path": "oracle/answers/775/play_keep_alive_clientbound_framed_dispatch.answer.jsonl",
  "rust_test_target": "oracle/rust-tests/tests/oracle_contracts.rs",
  "test_topology_note": "rust_test_target names the current case adapter only; the manifest owns the runnable test topology.",
  "stop_boundary": "Do not use this framed dispatch/decode contract to infer runtime keep-alive response behavior, Play entry, render readiness, or client-load completion."
}
