{
  "contract_id": "play_open_book_clientbound_framed_dispatch_contract",
  "case_id": "play_open_book_clientbound_framed_dispatch",
  "scope": "codec",
  "official_functions": [
    {
      "path": "_analysis/minecraft-26.1.2/client.jar",
      "function_or_member": "ClientboundOpenBookPacket(InteractionHand)",
      "role": "Construct the official Play clientbound open_book packet fixture"
    },
    {
      "path": "_analysis/minecraft-26.1.2/client.jar",
      "function_or_member": "ClientboundOpenBookPacket.STREAM_CODEC, FriendlyByteBuf.readEnum/writeEnum(InteractionHand)",
      "role": "Write, decode, and observe the official open_book body"
    },
    {
      "path": "_analysis/minecraft-26.1.2/client.jar",
      "function_or_member": "GameProtocols.CLIENTBOUND_TEMPLATE.details().listPackets(...)",
      "role": "Name the packet id assigned in Play clientbound state"
    }
  ],
  "invariants": [
    "The official Play clientbound table assigns open_book to packet id 0x3a.",
    "The official Play clientbound protocol codec dispatches the open_book id to ClientboundOpenBookPacket.",
    "The official open_book body is one InteractionHand enum ordinal through FriendlyByteBuf.writeEnum/readEnum.",
    "The fixture uses an enum constructor value and does not require initialized item, inventory, screen, or game state.",
    "The framed bytes, packet table id, body bytes, decoded packet class, decoded fields, Play clientbound packet table, and remaining decode byte counts are generated by the official jar-backed answer artifact.",
    "This contract does not prove held item, book UI behavior, inventory state, render readiness, or client-load completion."
  ],
  "answer_path": "oracle/answers/775/play_open_book_clientbound_framed_dispatch.answer.jsonl",
  "rust_test_target": "oracle/rust-tests/tests/oracle_contracts.rs",
  "test_topology_note": "rust_test_target names the current case adapter only; the manifest owns the runnable test topology.",
  "stop_boundary": "Do not use this framed dispatch/decode contract to infer held item, book UI behavior, inventory state, render readiness, or client-load completion."
}
