{
  "contract_id": "play_stop_sound_clientbound_framed_dispatch_contract",
  "case_id": "play_stop_sound_clientbound_framed_dispatch",
  "scope": "codec",
  "official_functions": [
    {
      "path": "_analysis/minecraft-26.1.2/client.jar",
      "function_or_member": "ClientboundStopSoundPacket(null, null), ClientboundStopSoundPacket.STREAM_CODEC, ClientboundStopSoundPacket.getName(), ClientboundStopSoundPacket.getSource()",
      "role": "Construct, write, decode, and observe the official Play clientbound stop_sound null/null body"
    },
    {
      "path": "_analysis/minecraft-26.1.2/client.jar",
      "function_or_member": "GameProtocols.CLIENTBOUND_TEMPLATE.details().listPackets(...)",
      "role": "Name the packet id assigned in Play clientbound state"
    }
  ],
  "invariants": [
    "The official Play clientbound table assigns stop_sound to packet id 0x77.",
    "For the null/null fixture, the official stop_sound body is one flags byte 0.",
    "For the null/null fixture, no SoundSource enum or sound Identifier follows the flags byte.",
    "The framed bytes, packet table id, body bytes, decoded packet class, null field presence, Play clientbound packet table, and remaining decode byte counts are generated by the official jar-backed answer artifact."
  ],
  "answer_path": "oracle/answers/775/play_stop_sound_clientbound_framed_dispatch.answer.jsonl",
  "rust_test_target": "oracle/rust-tests/tests/oracle_contracts.rs",
  "test_topology_note": "rust_test_target names the current case adapter only; the manifest owns the runnable test topology.",
  "stop_boundary": "Do not use this null/null fixture to infer named SoundSource ids or named sound Identifier bodies."
}
