{
  "contract_id": "play_disconnect_clientbound_framed_dispatch_contract",
  "case_id": "play_disconnect_clientbound_framed_dispatch",
  "scope": "codec",
  "official_functions": [
    {
      "path": "_analysis/minecraft-26.1.2/client.jar",
      "function_or_member": "Component.literal(String), ClientboundDisconnectPacket(Component)",
      "role": "Construct the official Play clientbound disconnect packet fixture"
    },
    {
      "path": "_analysis/minecraft-26.1.2/client.jar",
      "function_or_member": "ClientboundDisconnectPacket.STREAM_CODEC, ComponentSerialization.TRUSTED_CONTEXT_FREE_STREAM_CODEC",
      "role": "Write, decode, and observe the official disconnect body"
    },
    {
      "path": "_analysis/minecraft-26.1.2/client.jar",
      "function_or_member": "GameProtocols.CLIENTBOUND_TEMPLATE.details().listPackets(...)",
      "role": "Name the packet id assigned in Play clientbound state"
    },
    {
      "path": "_analysis/minecraft-26.1.2/client.jar",
      "function_or_member": "GameProtocols.CLIENTBOUND_TEMPLATE.bind(RegistryFriendlyByteBuf.decorator(RegistryAccess.EMPTY)).codec().encode/decode(ClientboundDisconnectPacket)",
      "role": "Write and dispatch-decode the full official Play clientbound disconnect frame"
    }
  ],
  "invariants": [
    "The official Play clientbound table assigns disconnect to packet id 0x20.",
    "The official Play clientbound protocol codec dispatches the disconnect id to ClientboundDisconnectPacket.",
    "The official disconnect body is a trusted context-free Component reason.",
    "The fixture uses Component.literal(String), so it does not require initialized UI, Level, registry contents, or game state.",
    "The framed bytes, packet table id, body bytes, decoded packet class, decoded reason text, Play clientbound packet table, and remaining decode byte counts are generated by the official jar-backed answer artifact.",
    "This contract does not prove UI disconnect handling, screen flow, runtime Play entry, world load, spawn readiness, render readiness, or client-load completion."
  ],
  "answer_path": "oracle/answers/775/play_disconnect_clientbound_framed_dispatch.answer.jsonl",
  "rust_test_target": "oracle/rust-tests/tests/oracle_contracts.rs",
  "test_topology_note": "rust_test_target names the current case adapter only; the manifest owns the runnable test topology.",
  "stop_boundary": "Do not use this framed dispatch/decode contract to infer UI disconnect handling, screen flow, runtime Play entry, world load, spawn readiness, render readiness, or client-load completion."
}
