{
  "contract_id": "play_boss_event_clientbound_framed_dispatch_contract",
  "case_id": "play_boss_event_clientbound_framed_dispatch",
  "scope": "codec",
  "official_functions": [
    {
      "path": "_analysis/minecraft-26.1.2/client.jar",
      "function_or_member": "GameProtocols.CLIENTBOUND_TEMPLATE.details().listPackets(...)",
      "role": "Name the packet id assigned in Play clientbound state"
    },
    {
      "path": "_analysis/minecraft-26.1.2/client.jar",
      "function_or_member": "ClientboundBossEventPacket.createRemovePacket(UUID), ClientboundBossEventPacket.STREAM_CODEC",
      "role": "Construct, write, and decode the boss_event remove-operation packet body"
    },
    {
      "path": "_analysis/minecraft-26.1.2/client.jar",
      "function_or_member": "RegistryFriendlyByteBuf.writeUUID/readUUID, RegistryFriendlyByteBuf.writeEnum/readEnum, REMOVE_OPERATION.write(...)",
      "role": "Define the UUID, operation enum, and empty remove-operation body shape"
    },
    {
      "path": "_analysis/minecraft-26.1.2/client.jar",
      "function_or_member": "GameProtocols.CLIENTBOUND_TEMPLATE.bind(RegistryFriendlyByteBuf.decorator(RegistryAccess.EMPTY)).codec().encode/decode(...)",
      "role": "Write and dispatch-decode the full official Play clientbound boss_event frame"
    },
    {
      "path": "_analysis/minecraft-26.1.2/client.jar",
      "function_or_member": "ClientGamePacketListener.handleBossUpdate(ClientboundBossEventPacket)",
      "role": "Confirm the official listener surface"
    }
  ],
  "invariants": [
    "The official Play clientbound table assigns boss_event immediately after block_update.",
    "The official Play clientbound protocol codec dispatches the boss_event id to ClientboundBossEventPacket.",
    "The official boss_event remove-operation body is UUID followed by operation enum, with no additional remove payload.",
    "The fixture uses official ClientboundBossEventPacket.createRemovePacket(UUID), so it does not require an initialized BossEvent, Level, or game state.",
    "The framed bytes, packet table id, body bytes, decoded packet class, decoded UUID, decoded operation, Play clientbound packet table, and remaining decode byte count are generated by the official jar-backed answer artifact.",
    "This contract does not prove add/update boss-bar payloads, boss-bar UI behavior, entity/world state, initialized game state, spawn readiness, world load, render readiness, or client-load completion."
  ],
  "answer_path": "oracle/answers/775/play_boss_event_clientbound_framed_dispatch.answer.jsonl",
  "rust_test_target": "oracle/rust-tests/tests/oracle_contracts.rs",
  "test_topology_note": "rust_test_target names the current case adapter only; the manifest owns the runnable test topology.",
  "stop_boundary": "Do not use this framed dispatch/decode contract to infer add/update boss-bar payloads, boss-bar UI behavior, entity/world state, initialized game state, spawn readiness, world load, render readiness, or client-load completion."
}
