{
  "contract_id": "play_system_chat_clientbound_framed_dispatch_contract",
  "case_id": "play_system_chat_clientbound_framed_dispatch",
  "scope": "codec",
  "official_functions": [
    {
      "path": "_analysis/minecraft-26.1.2/client.jar",
      "function_or_member": "Component.literal(String), ClientboundSystemChatPacket(Component, boolean), ClientboundSystemChatPacket.STREAM_CODEC, ComponentSerialization.TRUSTED_STREAM_CODEC, ByteBufCodecs.BOOL",
      "role": "Construct, write, decode, and observe the official Play clientbound system_chat body"
    },
    {
      "path": "_analysis/minecraft-26.1.2/client.jar",
      "function_or_member": "GameProtocols.CLIENTBOUND_TEMPLATE.details().listPackets(...)",
      "role": "Name the packet id assigned in Play clientbound state"
    }
  ],
  "invariants": [
    "The official Play clientbound table assigns system_chat to packet id 0x79.",
    "The official system_chat body is one trusted Component followed by one boolean overlay field.",
    "The generated fixture uses Component.literal(\"rustmine system chat\") and overlay false only.",
    "The framed bytes, packet table id, body bytes, decoded packet class, decoded text and overlay values, Play clientbound packet table, and remaining decode byte counts are generated by the official jar-backed answer artifact.",
    "This contract does not prove rich Component forms, chat HUD behavior, signed chat behavior, or client-load completion."
  ],
  "answer_path": "oracle/answers/775/play_system_chat_clientbound_framed_dispatch.answer.jsonl",
  "rust_test_target": "oracle/rust-tests/tests/oracle_contracts.rs",
  "test_topology_note": "rust_test_target names the current case adapter only; the manifest owns the runnable test topology.",
  "stop_boundary": "Do not use this framed dispatch/decode contract to infer rich Component, chat HUD behavior, signed chat behavior, or client-load completion."
}
