{
  "contract_id": "play_set_time_clientbound_framed_dispatch_contract",
  "case_id": "play_set_time_clientbound_framed_dispatch",
  "scope": "codec",
  "official_functions": [
    {
      "path": "_analysis/minecraft-26.1.2/client.jar",
      "function_or_member": "ClientboundSetTimePacket(long, Map.of()), ClientboundSetTimePacket.STREAM_CODEC, gameTime(), clockUpdates()",
      "role": "Construct, write, decode, and observe the official Play clientbound set_time empty clock update body"
    },
    {
      "path": "_analysis/minecraft-26.1.2/client.jar",
      "function_or_member": "GameProtocols.CLIENTBOUND_TEMPLATE.details().listPackets(...)",
      "role": "Name the packet id assigned in Play clientbound state"
    }
  ],
  "invariants": [
    "The official Play clientbound table assigns set_time to packet id 0x71.",
    "The empty-clock-update fixture body is one big-endian long followed by a zero map count.",
    "The framed bytes, packet table id, body bytes, decoded packet class, gameTime/count fields, Play clientbound packet table, and remaining decode byte counts are generated by the official jar-backed answer artifact."
  ],
  "answer_path": "oracle/answers/775/play_set_time_clientbound_framed_dispatch.answer.jsonl",
  "rust_test_target": "oracle/rust-tests/tests/oracle_contracts.rs",
  "test_topology_note": "rust_test_target names the current case adapter only; the manifest owns the runnable test topology.",
  "stop_boundary": "Do not use this framed dispatch/decode contract to infer WorldClock entries, ClockNetworkState entries, or time runtime behavior."
}
