{
  "contract_id": "login_hello_serverbound_framed_dispatch_contract",
  "case_id": "login_hello_serverbound_framed_dispatch",
  "scope": "codec",
  "official_functions": [
    {
      "path": "_analysis/minecraft-26.1.2/client.jar",
      "function_or_member": "ServerboundHelloPacket(String, UUID)",
      "role": "Construct the official Login serverbound hello packet fixture"
    },
    {
      "path": "_analysis/minecraft-26.1.2/client.jar",
      "function_or_member": "ServerboundHelloPacket.STREAM_CODEC.encode(...)",
      "role": "Write the official Login serverbound hello body"
    },
    {
      "path": "_analysis/minecraft-26.1.2/client.jar",
      "function_or_member": "LoginProtocols.SERVERBOUND.codec().encode(new ServerboundHelloPacket(...))",
      "role": "Write the full Login serverbound framed hello packet"
    },
    {
      "path": "_analysis/minecraft-26.1.2/client.jar",
      "function_or_member": "LoginProtocols.SERVERBOUND.codec().decode(...)",
      "role": "Dispatch and decode the full Login serverbound framed hello packet"
    },
    {
      "path": "_analysis/minecraft-26.1.2/client.jar",
      "function_or_member": "LoginProtocols.SERVERBOUND_TEMPLATE.details().listPackets(...)",
      "role": "Name the packet id assigned in Login serverbound state"
    },
    {
      "path": "_analysis/minecraft-26.1.2/client.jar",
      "function_or_member": "ServerboundHelloPacket.name(), profileId()",
      "role": "Read the decoded fields from the official packet instance"
    }
  ],
  "invariants": [
    "The official Login serverbound protocol codec writes the packet table id before the hello body.",
    "The official Login serverbound protocol codec dispatches the framed packet id to ServerboundHelloPacket.",
    "The decoded official ServerboundHelloPacket preserves name and profileId from the fixture.",
    "The framed bytes, packet table id, body bytes, decoded packet class, decoded packet type, decoded fields, and remaining decode byte count are generated by the official jar-backed answer artifact.",
    "This contract does not prove authentication success, encryption/key exchange, login acknowledgement, Configuration entry, or client-load completion."
  ],
  "answer_path": "oracle/answers/775/login_hello_serverbound_framed_dispatch.answer.jsonl",
  "rust_test_target": "oracle/rust-tests/tests/oracle_contracts.rs",
  "test_topology_note": "rust_test_target names the current case adapter only; the manifest owns the runnable test topology.",
  "stop_boundary": "Do not use this framed dispatch/decode contract to infer authentication success, encryption/key exchange, login acknowledgement, Configuration entry, or client-load completion."
}
