{
  "contract_id": "play_update_advancements_clientbound_framed_dispatch_contract",
  "case_id": "play_update_advancements_clientbound_framed_dispatch",
  "scope": "codec",
  "official_functions": [
    {
      "path": "_analysis/minecraft-26.1.2/client.jar",
      "function_or_member": "ClientboundUpdateAdvancementsPacket(boolean, Collection<AdvancementHolder>, Set<Identifier>, Map<Identifier, AdvancementProgress>, boolean), ClientboundUpdateAdvancementsPacket.STREAM_CODEC",
      "role": "Construct, write, decode, and observe the official empty Play clientbound update_advancements body"
    },
    {
      "path": "_analysis/minecraft-26.1.2/client.jar",
      "function_or_member": "GameProtocols.CLIENTBOUND_TEMPLATE.details().listPackets(...)",
      "role": "Name the packet id assigned in Play clientbound state"
    }
  ],
  "invariants": [
    "The official Play clientbound table assigns update_advancements to packet id 0x82.",
    "The generated fixture uses reset=false, showAdvancements=false, and empty added/removed/progress collections.",
    "The official body writes reset boolean, three zero collection/map counts, and showAdvancements boolean.",
    "The framed bytes, packet table id, body bytes, decoded packet class, decoded booleans, decoded counts, Play clientbound packet table, and remaining decode byte counts are generated by the official jar-backed answer artifact.",
    "This contract does not prove advancement tree, progress, UI, or client-load behavior."
  ],
  "answer_path": "oracle/answers/775/play_update_advancements_clientbound_framed_dispatch.answer.jsonl",
  "rust_test_target": "oracle/rust-tests/tests/oracle_contracts.rs",
  "test_topology_note": "rust_test_target names the current case adapter only; the manifest owns the runnable test topology.",
  "stop_boundary": "Do not use this framed dispatch/decode contract to infer non-empty advancement holder/progress payloads, advancement UI, or client-load behavior."
}
