{
  "contract_id": "play_ticking_state_clientbound_framed_dispatch_contract",
  "case_id": "play_ticking_state_clientbound_framed_dispatch",
  "scope": "codec",
  "official_functions": [
    {
      "path": "_analysis/minecraft-26.1.2/client.jar",
      "function_or_member": "ClientboundTickingStatePacket(float, boolean), ClientboundTickingStatePacket.STREAM_CODEC, ClientboundTickingStatePacket.tickRate(), ClientboundTickingStatePacket.isFrozen()",
      "role": "Construct, write, decode, and observe the official Play clientbound ticking_state body"
    },
    {
      "path": "_analysis/minecraft-26.1.2/client.jar",
      "function_or_member": "GameProtocols.CLIENTBOUND_TEMPLATE.details().listPackets(...)",
      "role": "Name the packet id assigned in Play clientbound state"
    }
  ],
  "invariants": [
    "The official Play clientbound table assigns ticking_state to packet id 0x7f.",
    "The official ticking_state body is float tickRate followed by boolean isFrozen.",
    "The framed bytes, packet table id, body bytes, decoded packet class, primitive fields, Play clientbound packet table, and remaining decode byte counts are generated by the official jar-backed answer artifact."
  ],
  "answer_path": "oracle/answers/775/play_ticking_state_clientbound_framed_dispatch.answer.jsonl",
  "rust_test_target": "oracle/rust-tests/tests/oracle_contracts.rs",
  "test_topology_note": "rust_test_target names the current case adapter only; the manifest owns the runnable test topology.",
  "stop_boundary": "Do not use this framed dispatch/decode contract to infer TickRateManager runtime semantics."
}
