{
  "contract_id": "play_chunk_batch_finished_clientbound_framed_dispatch_contract",
  "case_id": "play_chunk_batch_finished_clientbound_framed_dispatch",
  "scope": "codec",
  "official_functions": [
    {
      "path": "_analysis/minecraft-26.1.2/client.jar",
      "function_or_member": "GameProtocols.CLIENTBOUND_TEMPLATE.details().listPackets(...)",
      "role": "Name the packet id assigned in Play clientbound state"
    },
    {
      "path": "_analysis/minecraft-26.1.2/client.jar",
      "function_or_member": "ClientboundChunkBatchFinishedPacket(int), ClientboundChunkBatchFinishedPacket.STREAM_CODEC",
      "role": "Construct, write, and decode the chunk_batch_finished packet body"
    },
    {
      "path": "_analysis/minecraft-26.1.2/client.jar",
      "function_or_member": "private ClientboundChunkBatchFinishedPacket(FriendlyByteBuf), private write(FriendlyByteBuf), FriendlyByteBuf.readVarInt/writeVarInt",
      "role": "Define the batchSize field codec"
    },
    {
      "path": "_analysis/minecraft-26.1.2/client.jar",
      "function_or_member": "GameProtocols.CLIENTBOUND_TEMPLATE.bind(RegistryFriendlyByteBuf.decorator(RegistryAccess.EMPTY)).codec().encode/decode(...)",
      "role": "Write and dispatch-decode the full official Play clientbound chunk_batch_finished frame"
    },
    {
      "path": "_analysis/minecraft-26.1.2/client.jar",
      "function_or_member": "ClientGamePacketListener.handleChunkBatchFinished(ClientboundChunkBatchFinishedPacket)",
      "role": "Confirm the official listener surface"
    }
  ],
  "invariants": [
    "The official Play clientbound table assigns chunk_batch_finished immediately after change_difficulty.",
    "The official Play clientbound protocol codec dispatches the chunk_batch_finished id to ClientboundChunkBatchFinishedPacket.",
    "The official chunk_batch_finished body is batchSize encoded as a FriendlyByteBuf VarInt.",
    "The fixture uses official ClientboundChunkBatchFinishedPacket(int), so it does not require an initialized Level, chunk storage, or game state.",
    "The framed bytes, packet table id, body bytes, decoded packet class, decoded batchSize, Play clientbound packet table, and remaining decode byte count are generated by the official jar-backed answer artifact.",
    "This contract does not prove chunk batch pacing behavior, chunk-load completion, initialized game state, spawn readiness, world load, render readiness, or client-load completion."
  ],
  "answer_path": "oracle/answers/775/play_chunk_batch_finished_clientbound_framed_dispatch.answer.jsonl",
  "rust_test_target": "oracle/rust-tests/tests/oracle_contracts.rs",
  "test_topology_note": "rust_test_target names the current case adapter only; the manifest owns the runnable test topology.",
  "stop_boundary": "Do not use this framed dispatch/decode contract to infer chunk batch pacing behavior, chunk-load completion, initialized game state, spawn readiness, world load, render readiness, or client-load completion."
}
