{
  "contract_id": "configuration_update_tags_clientbound_framed_dispatch_contract",
  "case_id": "configuration_update_tags_clientbound_framed_dispatch",
  "scope": "codec",
  "official_functions": [
    {
      "path": "_analysis/minecraft-26.1.2/client.jar",
      "function_or_member": "ClientboundUpdateTagsPacket(Map<ResourceKey<? extends Registry<?>>, TagNetworkSerialization.NetworkPayload>)",
      "role": "Construct the official Configuration clientbound update_tags packet fixture"
    },
    {
      "path": "_analysis/minecraft-26.1.2/client.jar",
      "function_or_member": "ClientboundUpdateTagsPacket.STREAM_CODEC",
      "role": "Write and read the official Configuration clientbound update_tags body"
    },
    {
      "path": "_analysis/minecraft-26.1.2/client.jar",
      "function_or_member": "ConfigurationProtocols.CLIENTBOUND.codec().encode(ClientboundUpdateTagsPacket)",
      "role": "Write the full Configuration clientbound framed update_tags packet"
    },
    {
      "path": "_analysis/minecraft-26.1.2/client.jar",
      "function_or_member": "ConfigurationProtocols.CLIENTBOUND.codec().decode(...)",
      "role": "Dispatch and decode the full Configuration clientbound framed update_tags packet"
    },
    {
      "path": "_analysis/minecraft-26.1.2/client.jar",
      "function_or_member": "ConfigurationProtocols.CLIENTBOUND_TEMPLATE.details().listPackets(...)",
      "role": "Name the packet id assigned in Configuration clientbound state"
    },
    {
      "path": "_analysis/minecraft-26.1.2/client.jar",
      "function_or_member": "ClientboundUpdateTagsPacket.getTags()",
      "role": "Read the decoded tag registry payload map from the official packet instance"
    }
  ],
  "invariants": [
    "The official Configuration clientbound protocol codec writes the packet table id before the update_tags body.",
    "The official ClientboundUpdateTagsPacket.STREAM_CODEC writes a map from registry ResourceKey to TagNetworkSerialization.NetworkPayload.",
    "The official Configuration clientbound protocol codec dispatches the framed packet id to ClientboundUpdateTagsPacket.",
    "The decoded official ClientboundUpdateTagsPacket preserves the empty tag registry-payload map for this packet-support fixture.",
    "The framed bytes, packet table id, body bytes, decoded packet class, decoded fields, and remaining decode byte count are generated by the official jar-backed answer artifact.",
    "This contract does not prove real tag contents, tag registry hydration, Configuration completion, Play entry, world load, render readiness, or runtime behavior."
  ],
  "answer_path": "oracle/answers/775/configuration_update_tags_clientbound_framed_dispatch.answer.jsonl",
  "rust_test_target": "oracle/rust-tests/tests/oracle_contracts.rs",
  "test_topology_note": "rust_test_target names the current case adapter only; the manifest owns the runnable test topology.",
  "stop_boundary": "Do not use this framed dispatch/decode contract to infer real tag contents, tag registry hydration, Configuration-to-Play readiness, Play readiness, or runtime behavior."
}
