{
  "contract_id": "configuration_cookie_request_framed_dispatch_contract",
  "case_id": "configuration_cookie_request_framed_dispatch",
  "scope": "codec",
  "official_functions": [
    {
      "path": "_analysis/minecraft-26.1.2/client.jar",
      "function_or_member": "Identifier.parse(String), ClientboundCookieRequestPacket(Identifier)",
      "role": "Construct the official Configuration clientbound cookie_request packet fixture"
    },
    {
      "path": "_analysis/minecraft-26.1.2/client.jar",
      "function_or_member": "ClientboundCookieRequestPacket.STREAM_CODEC.encode(...)",
      "role": "Write the official Configuration clientbound cookie_request body"
    },
    {
      "path": "_analysis/minecraft-26.1.2/client.jar",
      "function_or_member": "ConfigurationProtocols.CLIENTBOUND.codec().encode(ClientboundCookieRequestPacket)",
      "role": "Write the full Configuration clientbound framed cookie_request packet"
    },
    {
      "path": "_analysis/minecraft-26.1.2/client.jar",
      "function_or_member": "ConfigurationProtocols.CLIENTBOUND.codec().decode(...)",
      "role": "Dispatch and decode the full Configuration clientbound framed cookie_request packet"
    },
    {
      "path": "_analysis/minecraft-26.1.2/client.jar",
      "function_or_member": "ConfigurationProtocols.CLIENTBOUND_TEMPLATE.details().listPackets(...)",
      "role": "Name the packet id assigned in Configuration clientbound state"
    },
    {
      "path": "_analysis/minecraft-26.1.2/client.jar",
      "function_or_member": "ClientboundCookieRequestPacket.key()",
      "role": "Read the decoded cookie_request key from the official packet instance"
    }
  ],
  "invariants": [
    "The official Configuration clientbound protocol codec writes the packet table id before the cookie_request body.",
    "The official Configuration clientbound protocol codec dispatches the framed packet id to ClientboundCookieRequestPacket.",
    "The decoded official ClientboundCookieRequestPacket preserves the Identifier key produced by the official fixture.",
    "The framed bytes, packet table id, body bytes, decoded packet class, key string, and remaining decode byte count are generated by the official jar-backed answer artifact.",
    "This contract does not prove cookie storage policy, cookie request/response runtime behavior, Configuration completion, or Play readiness."
  ],
  "answer_path": "oracle/answers/775/configuration_cookie_request_framed_dispatch.answer.jsonl",
  "rust_test_target": "oracle/rust-tests/tests/oracle_contracts.rs",
  "test_topology_note": "rust_test_target names the current case adapter only; the manifest owns the runnable test topology.",
  "stop_boundary": "Do not use this framed dispatch/decode contract to infer cookie storage policy, cookie request/response runtime behavior, Configuration-to-Play readiness, or Play readiness."
}
