{
  "contract_id": "play_set_score_clientbound_framed_dispatch_contract",
  "case_id": "play_set_score_clientbound_framed_dispatch",
  "scope": "codec",
  "official_functions": [
    {
      "path": "_analysis/minecraft-26.1.2/client.jar",
      "function_or_member": "ClientboundSetScorePacket(String, String, int, Optional.empty(), Optional.empty()), ClientboundSetScorePacket.STREAM_CODEC, owner(), objectiveName(), score(), display(), numberFormat()",
      "role": "Construct, write, decode, and observe the official Play clientbound set_score no-optional body"
    },
    {
      "path": "_analysis/minecraft-26.1.2/client.jar",
      "function_or_member": "GameProtocols.CLIENTBOUND_TEMPLATE.details().listPackets(...)",
      "role": "Name the packet id assigned in Play clientbound state"
    }
  ],
  "invariants": [
    "The official Play clientbound table assigns set_score to packet id 0x6e.",
    "The no-optional fixture body is owner string, objective name string, score VarInt, absent display marker, and absent number-format marker.",
    "The framed bytes, packet table id, body bytes, decoded packet class, scoreboard field values, Play clientbound packet table, and remaining decode byte counts are generated by the official jar-backed answer artifact."
  ],
  "answer_path": "oracle/answers/775/play_set_score_clientbound_framed_dispatch.answer.jsonl",
  "rust_test_target": "oracle/rust-tests/tests/oracle_contracts.rs",
  "test_topology_note": "rust_test_target names the current case adapter only; the manifest owns the runnable test topology.",
  "stop_boundary": "Do not use this framed dispatch/decode contract to infer scoreboard lifecycle, optional Component display bytes, number-format semantics, or UI behavior."
}
