{
  "contract_id": "play_sound_clientbound_framed_dispatch_contract",
  "case_id": "play_sound_clientbound_framed_dispatch",
  "scope": "codec",
  "official_functions": [
    {
      "path": "_analysis/minecraft-26.1.2/client.jar",
      "function_or_member": "ClientboundSoundPacket(Holder<SoundEvent>, SoundSource, double, double, double, float, float, long)",
      "role": "Construct the official Play clientbound sound fixture"
    },
    {
      "path": "_analysis/minecraft-26.1.2/client.jar",
      "function_or_member": "SoundEvents.AMBIENT_CAVE; SoundEvent.STREAM_CODEC; ByteBufCodecs.holder",
      "role": "Encode/decode the bounded SoundEvent holder through official network holder policy"
    },
    {
      "path": "_analysis/minecraft-26.1.2/client.jar",
      "function_or_member": "GameProtocols.CLIENTBOUND_TEMPLATE.bind(...).codec().encode/decode(ClientboundSoundPacket)",
      "role": "Write and dispatch the full Play clientbound framed packet"
    }
  ],
  "invariants": [
    "The official Play clientbound protocol codec writes the packet table id before the sound body.",
    "The official sound fixture preserves the SoundEvent holder value, source, quantized positions, volume, pitch, seed, and consumes the body.",
    "This contract does not prove arbitrary SoundEvent holders, world sound playback, sound asset readiness, or runtime behavior."
  ],
  "answer_path": "oracle/answers/775/play_sound_clientbound_framed_dispatch.answer.jsonl",
  "rust_test_target": "oracle/rust-tests/tests/oracle_contracts.rs",
  "test_topology_note": "rust_test_target names the current case adapter only; the manifest owns the runnable test topology.",
  "stop_boundary": "Do not use this packet-support contract to infer general sound registry, world sound, sound asset, or playback behavior."
}
