{
  "contract_id": "configuration_keepalive_clientbound_framed_dispatch_contract",
  "case_id": "configuration_keepalive_clientbound_framed_dispatch",
  "scope": "codec",
  "official_functions": [
    {
      "path": "_analysis/minecraft-26.1.2/client.jar",
      "function_or_member": "ConfigurationProtocols.CLIENTBOUND.codec().encode(...)",
      "role": "Write the full Configuration clientbound framed keep-alive packet"
    },
    {
      "path": "_analysis/minecraft-26.1.2/client.jar",
      "function_or_member": "ConfigurationProtocols.CLIENTBOUND.codec().decode(...)",
      "role": "Dispatch and decode the full Configuration clientbound framed keep-alive packet"
    },
    {
      "path": "_analysis/minecraft-26.1.2/client.jar",
      "function_or_member": "ConfigurationProtocols.CLIENTBOUND_TEMPLATE.details().listPackets(...)",
      "role": "Name the packet id assigned in Configuration clientbound state"
    },
    {
      "path": "_analysis/minecraft-26.1.2/client.jar",
      "function_or_member": "ClientboundKeepAlivePacket.getId()",
      "role": "Read the decoded keep-alive payload id from the official packet instance"
    }
  ],
  "invariants": [
    "The official Configuration clientbound protocol codec writes the packet table id before the keep-alive body.",
    "The official Configuration clientbound protocol codec dispatches the framed packet id to ClientboundKeepAlivePacket.",
    "The decoded official ClientboundKeepAlivePacket preserves the keep-alive payload id.",
    "The framed bytes, packet table id, and body bytes are generated by the official jar-backed answer artifact.",
    "This contract does not prove runtime keep-alive echo behavior, serverbound response handling, or Configuration completion."
  ],
  "answer_path": "oracle/answers/775/configuration_keepalive_clientbound_framed_dispatch.answer.jsonl",
  "rust_test_target": "oracle/rust-tests/tests/oracle_contracts.rs",
  "test_topology_note": "rust_test_target names the current case adapter only; the manifest owns the runnable test topology.",
  "stop_boundary": "Do not use this clientbound framed dispatch/decode contract to infer initialized runtime behavior or serverbound echo response behavior."
}
