{
  "contract_id": "play_set_entity_motion_clientbound_framed_dispatch_contract",
  "case_id": "play_set_entity_motion_clientbound_framed_dispatch",
  "scope": "codec",
  "official_functions": [
    {
      "path": "_analysis/minecraft-26.1.2/client.jar",
      "function_or_member": "ClientboundSetEntityMotionPacket(int, Vec3)",
      "role": "Construct the official Play clientbound set_entity_motion fixture"
    },
    {
      "path": "_analysis/minecraft-26.1.2/client.jar",
      "function_or_member": "ClientboundSetEntityMotionPacket.STREAM_CODEC, ByteBufCodecs.VAR_INT, Vec3.LP_STREAM_CODEC",
      "role": "Write, decode, and observe the official entity id plus movement body"
    },
    {
      "path": "_analysis/minecraft-26.1.2/client.jar",
      "function_or_member": "GameProtocols.CLIENTBOUND_TEMPLATE.details().listPackets(...)",
      "role": "Name the packet id assigned in Play clientbound state"
    }
  ],
  "invariants": [
    "The official Play clientbound table assigns set_entity_motion to packet id 0x65.",
    "The official Play clientbound protocol codec dispatches the set_entity_motion id to ClientboundSetEntityMotionPacket.",
    "The official set_entity_motion body is one VarInt entity id followed by Vec3.LP_STREAM_CODEC movement.",
    "The fixture uses a primitive entity id and Vec3 only and does not require initialized entity, Level, or render state.",
    "The framed bytes, packet table id, body bytes, decoded packet class, decoded movement fields, Play clientbound packet table, and remaining decode byte counts are generated by the official jar-backed answer artifact.",
    "This contract does not prove entity existence, movement semantics, world state, render readiness, or client-load completion."
  ],
  "answer_path": "oracle/answers/775/play_set_entity_motion_clientbound_framed_dispatch.answer.jsonl",
  "rust_test_target": "oracle/rust-tests/tests/oracle_contracts.rs",
  "test_topology_note": "rust_test_target names the current case adapter only; the manifest owns the runnable test topology.",
  "stop_boundary": "Do not use this framed dispatch/decode contract to infer entity existence, movement semantics, world state, render readiness, or client-load completion."
}
